{
  "history_schema_version": 1,
  "history_event_id": "a4c9f9a0-291e-41e5-babb-3c13b84c4bb4",
  "environment_id": "development",
  "service_name": "orders",
  "saga_type": "order-fulfillment",
  "saga_id": "order-42",
  "run_id": "de94b8eb-50c4-4a35-b324-59b9318af658",
  "sequence": "3",
  "event_type": "command.enqueued",
  "occurred_at": "2026-09-15T00:00:00Z",
  "recorded_at": "2026-09-15T00:00:00Z",
  "step_id": "reserve-inventory",
  "attempt": 1,
  "command_id": "reserve-42",
  "effect_id": "reserve-inventory:1",
  "source_event_id": "event-order-42",
  "correlation_id": "order-42",
  "source_topic": "orders.events",
  "source_partition": 2,
  "source_offset": "9007199254740993",
  "aggregate_type": "order",
  "aggregate_id": "order-42",
  "aggregate_version": "7",
  "payload": "{\"order_id\":\"order-42\"}"
}
